vendor_folder,vendor_name,vendor_address,vendor_postcode,ship_to_address,ship_to_postcode,service_center_address,service_center_postcode,invoice_number,invoice_date,amount,po_number,pdf_type,pdf_file,processed_file_path,status,error
FLEETPRIDE,FleetPride,,,10860 SW CLUTTER ST (360)-254-6920 SHERWOOD OR 97140-9563,97140,,,749,05/27/26,1070.0,,scanned_pdf,FLEETPRIDE INV # 134869923.pdf,,success,
LESHWEB,Les Schwab,"Les Schwab Invoice, Qty Product Code Product Description Price/ea FET Amount, 4 1131204 LT245/75R-17/10 OPEN RANGE AT PLUS $283.99 $0.00 $1,135.96, 4 13731 WHEEL SPIN BALANCE $19.99 $0.00 $79.96, 4 1046760 LIGHT TRUCK TIRE DISPOSAL $5.99 $0.00 $23.96, 4 1260064 AMERICAS BEST TIRE WARRANTY $0.00 $0.00 $0.00, 4 1116491 VS20 TIRE PRESSURE MONITORING SYSTEM REBUILD $9.25 $0.00 $37.00, Parts Subtotal: $1,196.92",13731,,,"Turlock, CA 95382 Invoice: 66800415007",95382,66800415007,05-26-26,1387.12,ST,real_pdf,66800415007.pdf,,success,
OILVENDOR,Valvoline,"VALVOLINE INSTANT OIL CHANGE na 2016 Ford F-550 Super Duty 090055-Corvallis Stayton, OR 97383 Lariat; 8CYL 6.7L, Power-Stroke, Turbocharged, MANAGER: Nicholas 971-235-6438 / DIESEL, MFI 5020 S_ W. Philomath Blvd OR Yarv775 LAST VISIT MILEAGE: Corvallis, OR 97333",97333,,,"VALVOLINE INSTANT OIL CHANGE na 2016 Ford F-550 Super Duty 090055-Corvallis Stayton, OR 97383 Lariat; 8CYL 6.7L, Power-Stroke, Turbocharged, MANAGER: Nicholas 971-235-6438 / DIESEL, MFI 5020 S_ W. Philomath Blvd OR Yarv775 LAST VISIT MILEAGE: Corvallis, OR 97333",97333,154281,04-25-25,300.78,71945,scanned_pdf,F005632-154281-001 - ENTERED.pdf,,success,
OILVENDOR,MyFleetCenter,"1130 N MAIN ST, Account #; JLI-22233, MANTECA, CA 953363208",22233,,,,,99923980,05-22-26,8143.62,7162,scanned_pdf,MY FLEET CENTER INV # 99923980.pdf,,success,
OILVENDOR,Valvoline,"VALVOLINE INSTANT OIL CHANGE NA 2018 Ford 090055---Corvallis Corvallis, OR 97330 F-150 MANAGER KJ XL, 6CYL 3.3L, Duratec, FLEX, Direct/Port Injection (B) 5020 S. W. Philomath Blvd OR 50246 Corvallis, OR 97333",97333,,,"VALVOLINE INSTANT OIL CHANGE NA 2018 Ford 090055---Corvallis Corvallis, OR 97330 F-150 MANAGER KJ XL, 6CYL 3.3L, Duratec, FLEX, Direct/Port Injection (B) 5020 S. W. Philomath Blvd OR 50246 Corvallis, OR 97333",97333,167142,01-20-26,116.21,50246,real_pdf,VALVOLINE INV # 167142.pdf,,success,
OILVENDOR,Valvoline,"VALVOLINE INSTANT OIL CHANGE 123 NA 2023 Mercedes-Benz 090055---Corvallis Shelton, WA 98584 Sprinter 2500 MANAGER KJ dwarner@northskycomm.com Base, 4CYL 2.0L (654.920), Turbocharged, DIESEL, DI 5020 S. W. Philomath Blvd OR X Corvallis, OR 97333",97333,,,"VALVOLINE INSTANT OIL CHANGE 123 NA 2023 Mercedes-Benz 090055---Corvallis Shelton, WA 98584 Sprinter 2500 MANAGER KJ dwarner@northskycomm.com Base, 4CYL 2.0L (654.920), Turbocharged, DIESEL, DI 5020 S. W. Philomath Blvd OR X Corvallis, OR 97333",97333,169564,03-10-26,144.1,699838,real_pdf,VALVOLINE INV # 169564.pdf,,success,
